{
  "schema_version": "0.2.10",
  "decision_id": "FDE-SYNTHETIC-SOURCE-001",
  "title": "Synthetic critical-material source qualification",
  "profile": "general",
  "question": "Should the synthetic alternate source enter bounded qualification, and under what evidence conditions?",
  "decision_owner": "Qualification lead",
  "time_horizon": "90 days",
  "urgency": "planned",
  "reversibility": "partially-reversible",
  "status": "draft",
  "stakeholders": [
    {
      "stakeholder_id": "STK-001",
      "name": "Qualification team",
      "role": "decision-maker",
      "objectives": [
        "OBJ-001",
        "OBJ-002"
      ]
    },
    {
      "stakeholder_id": "STK-002",
      "name": "Downstream operators",
      "role": "affected-party",
      "objectives": [
        "OBJ-003"
      ]
    },
    {
      "stakeholder_id": "STK-003",
      "name": "Independent reviewers",
      "role": "reviewer",
      "objectives": [
        "OBJ-001",
        "OBJ-004"
      ]
    }
  ],
  "evidence_summary": {
    "known": [
      "Synthetic supplier records and test artifacts are preserved with SHA-256 provenance.",
      "The synthetic evidence package contains repeatable device and process measurements.",
      "Production capacity, long-duration reliability, and field performance remain unresolved."
    ],
    "assumed": [
      "Additional synthetic lots may provide enough evidence for bounded qualification.",
      "Independent test replication would materially improve confidence."
    ],
    "unknown": [
      "Whether the measured performance can be reproduced across synthetic lots.",
      "Whether the alternate source can sustain the declared delivery window."
    ]
  },
  "uncertainties": [
    {
      "uncertainty_id": "UNC-001",
      "label": "Evidence repeatability",
      "description": "How consistently decision-relevant evidence repeats during the qualification window.",
      "states": [
        "low",
        "moderate",
        "high"
      ],
      "source_status": "unknown",
      "reducibility": "partially-reducible"
    },
    {
      "uncertainty_id": "UNC-002",
      "label": "Independent test outcome",
      "description": "Whether independent tests reproduce the declared performance and reliability envelope.",
      "states": [
        "explained",
        "partially-unresolved",
        "unresolved"
      ],
      "source_status": "not-yet-tested",
      "reducibility": "reducible"
    },
    {
      "uncertainty_id": "UNC-003",
      "label": "Available deployment budget",
      "description": "Resources available for test calibration, hardware, operations, and independent review.",
      "states": [
        "constrained",
        "adequate"
      ],
      "source_status": "decision-dependent",
      "reducibility": "partially-reducible"
    }
  ],
  "objectives": [
    {
      "objective_id": "OBJ-001",
      "label": "Evidence gain",
      "description": "Expected ability to increase decision-relevant evidence quality.",
      "threshold": 60,
      "unit": "desirability score",
      "direction": "at-least",
      "critical": true
    },
    {
      "objective_id": "OBJ-002",
      "label": "Affordability",
      "description": "Ability to remain within realistic financial and operating limits.",
      "threshold": 60,
      "unit": "desirability score",
      "direction": "at-least",
      "critical": true
    },
    {
      "objective_id": "OBJ-003",
      "label": "Supply continuity",
      "description": "Ability to maintain supply within the declared operating and delivery envelope.",
      "threshold": 70,
      "unit": "desirability score",
      "direction": "at-least",
      "critical": true
    },
    {
      "objective_id": "OBJ-004",
      "label": "Reversibility",
      "description": "Ability to stop, revise, or redirect the strategy without disproportionate loss.",
      "threshold": 60,
      "unit": "desirability score",
      "direction": "at-least",
      "critical": false
    }
  ],
  "relationships": [
    {
      "relationship_id": "REL-001",
      "statement": "Additional synchronized viewpoints can improve corroboration and enable geometric reconstruction when timing and test calibration are sufficient.",
      "evidence_class": "modeled",
      "confidence": "medium"
    },
    {
      "relationship_id": "REL-002",
      "statement": "Controlled known-target testing can reduce false-positive risk before larger deployment.",
      "evidence_class": "methodological",
      "confidence": "high"
    },
    {
      "relationship_id": "REL-003",
      "statement": "A staged strategy preserves the option to scale after defined evidence and repeatability triggers are met.",
      "evidence_class": "decision-model",
      "confidence": "medium"
    }
  ],
  "strategies": [
    {
      "strategy_id": "STR-001",
      "label": "Review existing evidence only",
      "description": "Complete test calibration review, metadata recovery, and controlled comparison without new field infrastructure.",
      "baseline": {
        "OBJ-001": 40,
        "OBJ-002": 95,
        "OBJ-003": 95,
        "OBJ-004": 95
      },
      "action_now": "Complete source, test calibration, and known-target review.",
      "monitor": "Residual unexplained signatures and repeatability reports.",
      "trigger": "Escalate if controls remain unresolved and repeatability is moderate or high.",
      "contingency": "Close or archive the case if controls explain the result adequately."
    },
    {
      "strategy_id": "STR-002",
      "label": "Qualify alternate source immediately",
      "description": "Purchase, calibrate, and operate a synchronized two-qualification path collection system now.",
      "baseline": {
        "OBJ-001": 90,
        "OBJ-002": 35,
        "OBJ-003": 80,
        "OBJ-004": 45
      },
      "action_now": "Acquire and deploy two synchronized qualification paths.",
      "monitor": "Capture quality, repeatability, operating cost, and community impact.",
      "trigger": "Continue while evidence gain remains material and operating limits are met.",
      "contingency": "Suspend deployment if cost or privacy thresholds are exceeded."
    },
    {
      "strategy_id": "STR-003",
      "label": "Stage conditional qualification",
      "description": "Finish controls and test calibration, prepare the second qualification path, and deploy only after explicit repeatability and quality triggers are met.",
      "baseline": {
        "OBJ-001": 80,
        "OBJ-002": 70,
        "OBJ-003": 90,
        "OBJ-004": 85
      },
      "action_now": "Complete controls, calibrate the first qualification path, and prepare a second synchronized unit.",
      "monitor": "Recurrence frequency, control similarity, source quality, and budget readiness.",
      "trigger": "Deploy when calibrated results recur and remain unresolved after controls.",
      "contingency": "Remain in low-cost monitoring mode if the trigger is not met."
    }
  ],
  "scenarios": [
    {
      "scenario_id": "SCN-001",
      "label": "Low repeatability and controls explain most signatures",
      "description": "Observations are rare and known-target tests reproduce the principal measurement pattern or motion patterns.",
      "states": {
        "UNC-001": "low",
        "UNC-002": "explained",
        "UNC-003": "adequate"
      },
      "strategy_modifiers": {
        "STR-001": {
          "OBJ-001": -10,
          "OBJ-002": 0,
          "OBJ-003": 0,
          "OBJ-004": 0
        },
        "STR-002": {
          "OBJ-001": -50,
          "OBJ-002": -10,
          "OBJ-003": -10,
          "OBJ-004": -10
        },
        "STR-003": {
          "OBJ-001": -35,
          "OBJ-002": 5,
          "OBJ-003": 0,
          "OBJ-004": 0
        }
      }
    },
    {
      "scenario_id": "SCN-002",
      "label": "Moderate repeatability with residual uncertainty",
      "description": "Some conventional controls fit, but a repeatable residual remains unresolved.",
      "states": {
        "UNC-001": "moderate",
        "UNC-002": "partially-unresolved",
        "UNC-003": "adequate"
      },
      "strategy_modifiers": {
        "STR-001": {
          "OBJ-001": 5,
          "OBJ-002": 0,
          "OBJ-003": 0,
          "OBJ-004": 0
        },
        "STR-002": {
          "OBJ-001": 0,
          "OBJ-002": 0,
          "OBJ-003": 0,
          "OBJ-004": 0
        },
        "STR-003": {
          "OBJ-001": 0,
          "OBJ-002": 0,
          "OBJ-003": 0,
          "OBJ-004": 0
        }
      }
    },
    {
      "scenario_id": "SCN-003",
      "label": "High repeatability and controls remain unresolved",
      "description": "Calibrated results recur and conventional controls do not reproduce the relevant signatures.",
      "states": {
        "UNC-001": "high",
        "UNC-002": "unresolved",
        "UNC-003": "adequate"
      },
      "strategy_modifiers": {
        "STR-001": {
          "OBJ-001": 10,
          "OBJ-002": -5,
          "OBJ-003": 0,
          "OBJ-004": 0
        },
        "STR-002": {
          "OBJ-001": 5,
          "OBJ-002": -5,
          "OBJ-003": -5,
          "OBJ-004": -5
        },
        "STR-003": {
          "OBJ-001": 10,
          "OBJ-002": -5,
          "OBJ-003": 0,
          "OBJ-004": 0
        }
      }
    },
    {
      "scenario_id": "SCN-004",
      "label": "Useful repeatability but constrained funding",
      "description": "Collection remains potentially valuable, but available deployment resources are limited.",
      "states": {
        "UNC-001": "moderate",
        "UNC-002": "partially-unresolved",
        "UNC-003": "constrained"
      },
      "strategy_modifiers": {
        "STR-001": {
          "OBJ-001": 0,
          "OBJ-002": 0,
          "OBJ-003": 0,
          "OBJ-004": 0
        },
        "STR-002": {
          "OBJ-001": 0,
          "OBJ-002": -25,
          "OBJ-003": -5,
          "OBJ-004": -10
        },